URL,Last Modification,News Title,News Publication Date,News Name,News Language,Text Content
https://www.vrt.be/vrtnws/nl/2023/07/03/bedwantsen-het-souvenir-dat-je-liever-niet-meebrengt-vanop-vaka/,,"Bedwantsen, het souvenir dat je liever niet meebrengt vanop vakantie",2023-07-31T05:40:00+02:00,VRT NWS,nl,"Je bent net terug van vakantie, je kijkt uit naar een heerlijke nacht in je eigen bed, maar plots krijg je overal jeuk en rode bultjes. Een mug, een leger muggen? Neen, de kans is reëel dat je bezoek hebt van... bedwantsen. Hoe komen ze in je bed terecht? En vooral: hoe kan je vermijden dat ze jouw huis koloniseren?
Bedwantsen zijn kruipende, roodbruine insectjes, die niet groter worden dan 8,5 millimeter en vooral in warmere gebieden voorkomen. Larven (of ""nimfen"") zijn tussen 1 en 6 millimeter groot en zijn ook lichter van kleur, tenzij ze net bloed hebben gezogen (zie foto helemaal onderaan).
De beten zelf lijken wat op muggenbeten en kunnen ook jeuken, al zal de ene persoon er meer last van hebben dan de andere. ""Het verschil met muggenbeten is dat de beten van bedwantsen vaak geclusterd zijn, met meerdere beten op een kleine huidoppervlakte"", zegt medisch milieudeskundige Tine Vande Maele. ""Als dat het geval is, is de kans groot dat je met bedwantsen te maken hebt.""
Bedwantsen zijn dus op zoek naar bloed en verblijven dan ook graag waar veel mensen dicht op elkaar leven, zoals hotels of vakantieparken. Overdag verbergen ze zich op alle mogelijke plaatsen: spleten in de muren, achter plinten, in de zoom van matrassen, in gordijnen, kledij, of zelfs in stopcontacten.
Je kan misschien niet volledig uitsluiten dat bedwantsen de weg naar je bed vinden, maar met deze tips raak je toch al een eind ver:
2. Weer thuis na vakantie:
Als de bedwantsen ondanks alle voorzorgen zich toch een weg gebaand hebben tot aan je bed (en dat merk je vaak pas als ze er al enkele weken vertoeven),bel dan een professionele bestrijder."
https://www.vrt.be/vrtnws/nl/2023/07/30/nu-al-2-keer-meer-aziatische-hoornaars-geteld-dan-heel-vorig-jaa/,,"Nu al 2 keer zoveel Aziatische hoornaars gemeld als heel vorig jaar ""en het seizoen is nog maar pas begonnen""",2023-07-30T19:56:22+02:00,VRT NWS,nl,"In de eerste drie weken van juli zijn er opnieuw 362 nesten van Aziatische hoornaars opgespoord en vernietigd. Dat zegt het Vlaams Bijeninstituut. De wespensoort is in opmars en vormt een bedreiging voor de inheemse honingbijen. Dit jaar zouden er al meer dan 2.800 koninginnen en nesten zijn gemeld tegenover 1.400 heel vorig jaar. ""En dat is wellicht nog een grote onderschatting"", zegt Kevin Verbeek van het expertisecentrum Aziatische hoornaar.
Het was voorspeld en de cijfers blijken het voorlopig te bevestigen: het aantal Aziatische hoornaars in Vlaanderen is opnieuw fors toegenomen.
Toegegeven, de cijfers geven geen volledig beeld. ""Dat is één van de problemen"", zegt Verbeek. ""Er is sinds dit jaar geen centraal platform meer om Aziatische hoornaars te melden.""
BEKIJK - VRT NWS maakte eerder deze video over hoe je een Aziatische hoornaar kan onderscheiden van een Europese hoornaar:
Volgens Verbeek worden de meeste nesten van Aziatische hoornaars gewoonlijk ook pas in het najaar ontdekt. ""Het seizoen moet eigenlijk nog beginnen.""
Experten dringen al langer aan bij de Vlaamse overheid op een betere aanpak en meer financiële steun voor de bestrijding van de Aziatische hoornaar.
""Als zo'n groot nest in een hoge boom in je tuin hangt, dan heb je daar meestal geen last van. Wil je het toch laten weghalen, dan kost dat al vlug 150 tot 200 euro. Veel mensen gaan daar dus niet voor willen betalen. Het is nochtans belangrijk om die nesten uit te roeien."""
https://www.vrt.be/vrtnws/nl/2023/07/30/wisselvallig-weer-houdt-75-000-bezoekers-op-sfinks-mixed-in-boec/,,"Wisselvallig weer houdt 75.000 bezoekers op Sfinks Mixed in Boechout niet tegen: ""Meer volk dan vorige jaren""",2023-07-30T19:41:14+02:00,VRT NWS,nl,"Ruim 75.000 bezoekers zijn afgezakt naar het gratis festival Sfinks Mixed in Boechout. Ondanks het wisselvallige weer kan de organisatie spreken van een succesvolle editie, met meer festivalgangers dan de afgelopen jaren. ""Het was een fijn weekend, met gevarieerde concerten en een gevarieerd publiek"", aldus artistiek directeur Patrick De Groote.
Het vierdaagse gratis festival Sfinks Mixed in Boechout loopt op zijn einde en de organisatie mag spreken over een succesvolle editie. ""Het was zeer fijn met heel afwisselende concerten en een afwisselend publiek"", vertelt artistiek directeur Patrick De Groote. ""We hebben ruim 75.000 bezoekers ontvangen in Boechout. Het is geleden van 2017 of 2018 dat we meer festivalgangers hebben gehad. We zijn heel tevreden.""
Het wisselvallige weer gooide dus geen roet in het eten. ""Dat heeft niet echt voor problemen gezorgd. Het was een typisch Belgisch weekend, met soms regen en soms zonneschijn. Je wist 's ochtends niet hoe het weer in de namiddag zou zijn. Iedereen had wel een regenjas of paraplu bij, maar de zonnige momenten waren uiteraard leuker.""
Sfinks Mixed is een heel divers festival, met verschillende culturen en wereldmuziek. ""Daar krijgen we ook zeer positieve reacties over"", aldus Patrick. ""Het is een festival waar je nieuwe dingen ontdekt. Muzikale acts van DJ's tot Afrikaanse popartiesten, dansvoorstellingen en workshops voor kinderen. Het was een heel fijne cocktail van verschillende stijlen. Op de podia en in het publiek zag je heel de wereld bij elkaar.""
Na een succesvolle editie heeft de organisatie al opnieuw energie voor volgend jaar. ""We gaan eerst deze editie evalueren in het kader van volgend jaar. Sfinks zal dan opnieuw plaatsvinden in het laatste weekend van juli en hopelijk wordt het nog specialer en mooier."""
https://www.vrt.be/vrtnws/nl/2023/07/30/gemengde-gevoelens-bij-antwerpse-handelaars-over-soldenmaand/,,"Gemengde gevoelens bij Antwerpse handelaars over soldenmaand: ""Slecht weer was spelbreker""",2023-07-30T17:59:21+02:00,VRT NWS,nl,"De Antwerpse winkeluitbaters kijken met gemengde gevoelens terug op de koopjesperiode in juli. De handelaars kenden een sterk openingsweekend, maar het slechte weer zorgde voor een spelbreker. Toch eindigt de soldenmaand met een positieve noot, dankzij de festivalgangers van Tomorrowland die in de stad logeerden.
Het laatste weekend van de koopjesperiode in Antwerpen zit erop. ""Zaterdag was er nog veel volk in de winkelstraten en zijn er nog veel koopjes de deur uitgegaan"", zegt regioverantwoordelijke Nico Volckeryk van het Neutraal Syndicaat voor Zelfstandigen (NSZ). ""Ook de bezoekers van Tomorrowland hebben er een schepje bovenop gedaan.""
Met het laatste weekend zit ook de soldenmaand er bijna op. ""Maar er zullen maandag nog veel koopjes zijn in de winkel, aangezien er in augustus al een nieuwe stock komt."" Toch zal de laatste koopjesdag niet veel meer veranderen aan de afgelopen periode. ""De maand was niet goed, maar ook niet slecht. Het was status quo.""
De koopjesperiode begon wel met een knal. ""Het eerste weekend was een succes. In Antwerpen was het over de koppen lopen. De dagen nadien bleef de verkoop goed gaan en dachten de handelaars dat het een topmaand zou worden. Helaas zorgde het slechte weer voor een spelbreker."" En dan komt Tomorrowland als geroepen. ""In de laatste twee weekends zien we wel dat veel festivalgangers koopjes komen doen in Antwerpen, vooral de bezoekers die hier logeren. In dat opzicht is het wel een leuke extra.""
Toch blijven de solden een sterk merk, volgens Nico. ""Er is veel veranderd de laatste jaren. Doorheen het jaar zijn er al veel kortingen of acties en de e-commerce heeft ook veel invloed, maar de solden blijven een sterk handelsmerk. In het weekend komen bezoekers zelfs overnachten in Antwerpen, omdat ze weten dat er solden zijn. Niet alleen Belgen, maar ook vanuit Nederland, Duitsland en Frankrijk komen ze naar hier.""
Vanaf 1 augustus verandert het parkeerbeleid in de stad Antwerpen en mogen bezoekers niet meer op straat parkeren. ""We vrezen niet dat we veel klanten gaan verliezen. Ze kunnen nog altijd in ondergrondse parkings terecht of hun auto achterlaten aan park and rides en met het openbaar vervoer komen."" En nu de soldenmaand voorbij is, hebben de handelaars nog veel om naar uit te kijken. ""De Bollekesfeesten en de Antwerp Gay Pride lokken altijd veel volk naar de stad. En het Antwerpse modeweekend in oktober is ontzettend populair, we blijven optimistisch."""
https://www.vrt.be/vrtnws/nl/2023/07/30/demi-vollering-wint-de-tour-lotte-kopecky-verrassende-tweede-na/,,"Demi Vollering wint de Tour, Lotte Kopecky verrassende tweede na sterke tijdrit",2023-07-30T17:40:18+02:00,VRT NWS,nl,De Nederlandse Demi Vollering heeft zoals verwacht de Tour de France Femmes gewonnen. Lotte Kopecky heeft zich dankzij de tijdrit van haar leven naar de tweede plaats gereden.Lees meer op website van Sporza.
https://www.vrt.be/vrtnws/nl/2023/07/30/bergen-verbiedt-samenscholingen-van-meer-dan-5-mensen-in-station/,,Bergen verbiedt samenscholingen van meer dan 5 mensen in stationswijk,2023-07-30T17:29:48+02:00,VRT NWS,nl,"Burgemeester Nicolas Martin (PS) van Bergen verbiedt alle samenscholingen van meer dan vijf personen in de stationswijk. Dat melden verschillende Franstalige media. De politie gaat ook meer patrouilles uitvoeren en auto's en voetgangers in de buurt van het station vaker controleren. Na een schietincident en een steekpartij eerder deze maand had de politie al extra agenten ingezet.
De nieuwe maatregelen zullen twee maanden van kracht blijven en kunnen indien nodig worden verlengd. ""Ik wil de buurt schoonvegen en mensen afschrikken die niets te zoeken hebben in dit deel van de stad"", zegt burgemeester Martin in een persmededeling. ""Het zijn strenge maatregelen, maar ik wil de politie alle mogelijke middelen geven om de toestand in de buurt te normaliseren.""
Buurtbewoners reageren positief op de beslissing van de burgemeester. ""Ik kom wel eens laat op de dag thuis van bij mijn dochter"", zegt een vrouw aan de Franstalige omroep RTBF. ""Maar als het donker is, ga ik niet door deze straat. Dan neem ik liever een taxi."""
https://www.vrt.be/vrtnws/nl/2023/07/30/korenslang-gevonden-in-huis-in-lissewege-komt-vaker-voor-in-de/,,"Korenslang van 40 centimeter gevonden in huis in Lissewege: ""In de zomer krijgen we meeste meldingen""",2023-07-30T17:23:35+02:00,VRT NWS,nl,"In Lissewege bij Brugge heeft iemand plots een wurgslang van ongeveer 40 centimeter aangetroffen in zijn huis. Het gaat om een gele korenslang: die zijn ongevaarlijk voor de mensen en zijn legaal in ons land. Het is nog niet duidelijk hoe de slang in het huis is terechtgekomen en waar hij vandaan kwam.
Gisteren kreeg de brandweer van Brugge een oproep binnen van een inwoner die plots een slang in zijn huis aantrof. Zij schakelden de verzorgers van SOS Reptiel in. ""Ze zagen al snel dat het ging om een korenslang, één van de populairste slangen die in ons land worden gehouden"", reageert Mario Goes van SOS Reptiel.
Tijdens de zomer krijgen ze meer meldingen van slangen die zich binnendringen in huizen. ""Dat komt door het warme weer"", gaat Mario verder. ""Daardoor laten slangen zich sneller zien. Als een slang ontsnapt in de winter, dan overleeft die dat vaak niet, waardoor we ook geen meldingen krijgen."""
https://www.vrt.be/vrtnws/nl/2023/07/30/niger-betoging/,,"Franse ambassade aangevallen in Niger, West-Afrikaanse landen treffen financiële sancties en dreigen met interventie",2023-07-30T16:55:12+02:00,VRT NWS,nl,"In het West-Afrikaanse land Niger is de Franse ambassade aangevallen door voorstanders van de militaire staatsgreep eerder deze week. Frankrijk veroordeelt het geweld en zegt dat het onmiddellijk zal reageren als Franse onderdanen of belangen aangevallen zouden worden.
Duizenden voorstanders van de militaire staatsgreep kwamen vandaag op straat in Niamey, de hoofdstad van Niger. Ze riepen anti-Franse en antiwesterse slogans en maakten duidelijk dat ze de Franse en westerse troepen uit hun land willen zien vertrekken. Sommige betogers zwaaiden ook met de Russische vlag, een fenomeen dat de laatste tijd wel vaker te zien is in Afrikaanse landen. Sommigen zien in Rusland een goed alternatief voor de voormalige koloniale machten.
Frankrijk veroordeelt het geweld en roept de Nigerese autoriteiten op om de veiligheid te verzekeren. Frankrijk zegt ook dat het onmiddellijk zal reageren als Franse burgers, militairen of economische belangen aangevallen zouden worden.
BEKIJK - Voorstanders van de staatsgreep uiten hun woede op de Franse ambassade:
ECOWAS, de Economische Organisatie van West-Afrikaanse Staten, heeft intussen sancties aangekondigd tegen de coupplegers. De lidstaten schorten alle economische en financiële samenwerking met Niger op. De organisatie sluit ook geweld niet uit als de afgezette president Bazoum niet binnen de week opnieuw aan de macht wordt gebracht."
https://www.vrt.be/vrtnws/nl/2023/07/30/tomorrowland-reactie-op-tweede-dode/,,"Tomorrowland na dood van bezoeker en medewerker: ""We gaan het festival nooit drugsvrij kunnen krijgen""",2023-07-30T16:51:03+02:00,VRT NWS,nl,"Zelfs met strikte controles kan Tomorrowland niet vermijden dat mensen drugs gebruiken of als gevolg daarvan overlijden. Dat zegt woordvoerder Debby Wilmsen na de dood van een bezoeker en een medewerker. ""We doen alles om het festival veilig te laten verlopen.""
Een overleden medewerker vorig weekend en een overleden bezoeker dit weekend: die trieste balans tekent Tomorrowland (opnieuw) op. Hoewel de doodsoorzaak van de beide mensen nog moet worden vastgesteld, vermoedt het parket dat het overlijden van de medewerker met drugs heeft te maken. In dat geval is het lang niet voor het eerst dat mensen op Tomorrowland sterven als gevolg van druggebruik.
""We doen echt alles om het festival veilig te laten verlopen"", zegt woordvoerder Debby Wilmsen. ""Hier komen veel mensen samen: elke dag 70.000 bezoekers en ook 15.000 leden van de crew. We bouwen zo een ministad en kunnen niet vermijden dat hier dingen gebeuren die ook in de maatschappij voorkomen.""
""Hier zullen ook diefstallen gebeuren, zullen sommige mensen anderen lastigvallen of discrimineren en zullen anderen drugs verkopen en gebruiken. We gaan het festival nooit drugsvrij kunnen krijgen. Zelfs als we keiveel mankracht extra inschakelen en iedereen bijna naakt zouden fouilleren, kunnen we dat niet vermijden. Dat is een utopie.""
BEKIJK - ""Hier komen dit weekend 200.000 mensen, de meesten zijn niet op de hoogte dat gisteren een dode is gevallen"", zegt collega Ferre Windey in ""Het journaal"":
Volgens Wilmsen zet Tomorrowland vooral in op sensibilisering. ""In de eerste plaats om buitenlanders duidelijk te maken dat alle drugs in België verboden zijn. Vaak is dat een groot vraagteken. In de tweede plaats roepen we iedereen op hulp te zoeken en niet bang te zijn. We gaan je niet beoordelen of veroordelen voor een beslissing die je hebt gemaakt. Onze medische diensten doen alles om je te helpen.""
Praktische communicatie doet Tomorrowland niet via sociale media. ""Onze sociale media zijn heel groot: bijna 5 miljoen volgers op TikTok, 11 miljoen op Facebook en 9 miljoen op Instagram. Dat zijn enorme aantallen. Vaak zijn het mensen die wel van ons merk houden, maar niet per se verbonden zijn met wat hier in Boom gebeurt.""
Om die reden heeft Tomorrowland ook niet via sociale media gecommuniceerd over de dood van de medewerker en de bezoeker, zegt Wilmsen. ""We wilden hun families de kans geven om alles discreet en sereen te kunnen verwerken.""
Wie wél op het festival aanwezig is, krijgt heel gericht communicatie aangereikt. ""Het gaat dan bijvoorbeeld over waar de hulpposten zijn of waarschuwingen over het weer. Afhankelijk van de boodschap, doen we dat via schermen, via een krantje dat we elke dag verdelen, via de app met notificatie die we kunnen uitsturen of via e-mail.""
BEKIJK - Moet drugsbeleid van Tomorrowland scherper? ""We nemen al erg veel maatregelen"", zegt de organisatie:
Los van de twee doden, blikt Wilmsen tevreden terug op dit en vorig festivalweekend. ""Het was onze 17e editie, volgend jaar vieren we 20 jaar Tomorrowland. Wat onze organisatie betreft, zijn we blij. We hebben een mooi festival neergezet. De domper op de feestvreugde waren dingen die we niet in de hand hadden: het kwakkelweer en helaas de twee doden.""
""Komende nacht beginnen we het terrein hier in Boom al af te breken. Morgen verlaten 38.000 mensen de camping Dreamville, vóór 14 uur vanuit Rumst. Na elk festivalweekend maken we een evaluatie en bekijken we wat beter kan, op alle vlakken. We sturen ook een enquête uit naar de bezoekers die ze goed opvolgen.""
Het drugsvraagstuk is sowieso een punt dat Tomorrowland onder de loep zal nemen, zegt Wilmsen. ""Zeker wat crew en personeel betreft, moeten we kijken wat we extra kunnen doen. Binnen het wettelijke kader proberen we ons ding te doen met controles en informatie, maar we gaan nooit kunnen voorkomen dat hier iets gebeurt.""
BEKIJK - ""Ik heb mijn enkel verzwikt, maar wil weer feesten"": een blik in de medische post op Tomorrowland
Korpschef Peter Muyshondt: ""We kijken met een redelijk goed gevoel terug""
BEKIJK - ""Ook over treurig nieuws moet je transparant zijn"": bezoekers verdeeld over communicatie van Tomorrowland"
https://www.vrt.be/vrtnws/nl/2023/07/30/minder-vermiste-kinderen-aan-kust/,,Natte eerste juliweken zorgen voor sterke daling in aantal verloren gelopen personen aan de kust,2023-07-30T16:19:14+02:00,VRT NWS,nl,"Aan de Belgische kust werden in de eerste twee weken van juli 116 verloren gelopen personen gemeld. Dat zijn er meer dan de helft minder dan de 336 die in dezelfde periode vorig jaar werden geregistreerd. De hoofdreden daarvoor is het natte weer dat sowieso minder mensen richting zee lokte.
Een rustige zomer aan de kust betekent voorlopig ook een rustige zomer voor de reddingsdiensten die verloren gelopen personen moeten helpen. In de eerste twee weken van juli noteerden de kustreddingsdiensten 116 verloren gelopen personen. Meer dan de helft minder dan dezelfde periode vorig jaar toen 336 gevallen gemeld werden.
In de meeste voorvallen gaat het om kinderen die hun ouders kwijtraken, maar ook om bijvoorbeeld personen met een beperking, ouderen of mensen die verward zijn.
De kustgemeente waar de meeste mensen nog steeds verdwaald geraken, blijft Oostende (27 personen), gevolgd door Knokke-Heist (18) en Blankenberge (16). ""Ook niet onlogisch"", zegt Beun. ""Het gaat om drie kustgemeenten met een eindstation en een vlotte treinverbinding."""
https://www.vrt.be/vrtnws/nl/2023/07/30/pakistan-bom/,,Tientallen doden en gewonden bij zelfmoordaanslag op politieke bijeenkomst in Pakistan,2023-07-30T16:08:55+02:00,VRT NWS,nl,"In het noordwesten van Pakistan zijn zeker 40 mensen om het leven gekomen bij een zelfmoordaanslag tijdens een politieke bijeenkomst. Meer dan 100 mensen raakten gewond. In Pakistan vinden later dit jaar parlementsverkiezingen plaats. Het land is al geruime tijd politiek instabiel.
Zeker 40 doden en meer dan 100 gewonden. Dat is de voorlopige balans van een bomaanslag tijdens een bijeenkomst van de radicaal-islamistische partij Jamiat Ulema-e-Islam, die deel uitmaakt van de Pakistaanse regering. Een van de doden is de lokale leider van de partij. Ook enkele nationale kopstukken waren aanwezig, maar zij bleven ongedeerd."
https://www.vrt.be/vrtnws/nl/2023/07/30/motorrijder-zwaargewond-na-ongeval-op-kruispunt-noorderlaan-in-a/,,Motorrijder zwaargewond na botsing op kruispunt Noorderlaan in Antwerpen,2023-07-30T15:55:06+02:00,VRT NWS,nl,"Een motorrijder is zwaargewond geraakt na een verkeersongeval op het kruispunt van de Groenendaallaan en Noorderlaan, in Antwerpen. De motard en een automobilist reden beiden het kruispunt op en knalden tegen elkaar. De motorrijder is niet in levensgevaar. De bestuurster van de wagen was onder de indruk en kreeg slachtofferzorg aangeboden.
Zaterdagavond is een motorrijder zwaargewond naar het ziekenhuis overgebracht. De motard reed over de Noorderlaan in de richting van het stadscentrum en een automobilist reed dan weer van de Groenendaallaan richting het cinemacomplex. De twee voertuigen reden samen het kruispunt op en knalden tegen elkaar. Hoe het ongeval is gebeurd, wordt nog uitgeklaard aan de hand van de verklaringen.
De motorrijder raakte zwaargewond, maar is niet in levensgevaar. Een hondenteam reed toevallig langs en diende de eerste zorgen toe, in afwachting van een interventieteam. De bestuurster van de wagen was erg onder de indruk van wat er gebeurd was en kreeg slachtofferzorg aangeboden.
Er was een tijdje verkeershinder voor wie vanuit de richting van de Vossenschijnstraat kwam en voor wie het kruispunt wilde oprijden."
https://www.vrt.be/vrtnws/nl/2023/07/30/oud-directeur-van-school-in-keerbergen-waar-bea-les-gaf/,,Oud-directeur van school in Keerbergen waar Bea les gaf: “Misschien heb ik haar dat duwtje gegeven om leerkracht te worden”,2023-07-30T15:22:11+02:00,VRT NWS,nl,"Bea Van der Maat koos in 2004 voor een nieuwe carrière en ging aan de slag als leerkracht in de middenschool van het KA Keerbergen. Het was de toenmalige directeur Luc Borgions die haar de vacature voor leerkracht Engels voorstelde: “Het was een toevallige samenloop van omstandigheden, maar ze zei meteen ja.”
Oud-directeur van de middenschool van het KA Keerbergen, Luc Borgions, heeft alleen maar mooie herinneringen aan Bea Van der Maat: “Een heel lieve, sympathieke, meelevende vrouw. Waar ze kon helpen, was ze altijd de eerste om te helpen. Ook een timide vrouw, maar zet ze op een podium en dan werd ze een echt podiumbeest.”
“Achteraf heeft ze me toevertrouwd dat leerkracht worden één van de beste beslissingen was die ze ooit in haar leven genomen had. Ze kon zichzelf zijn bij de collega’s, ze werd daar niet beschouwd als een BV en ze kon haar ding doen met de leerlingen. Ze was echt een supermadam"", aldus Luc.
Luc werkte bijna 15 jaar lang samen met Bea. In 2004 begon zij als leerkracht, in 2018 ging Luc met pensioen. “Ze was altijd heel bezorgd om haar leerlingen. Ze heeft de muziek ook nooit afgezworen, ze is dat blijven gebruiken in de klas.  Ze printte songteksten uit en ging ermee aan de slag. Zo hield ze de aandacht van de leerlingen vast. Ze is muziek blijven gebruiken in haar onderwijscarrière.”
Op het trouwfeest van directeur Luc kwam Bea ook onverwacht optreden met haar band. “Ik had ooit gezegd dat als ik zou trouwen, dat ze moest komen optreden. Maar Bea zei dat ze dat niet graag deed. Ze had ook een smoesje verzonnen dat ze naar Engeland moest en er niet kon bij zijn. Maar op de trouwavond zelf stond ze daar met haar band als verrassing. Dat was ze ten voeten uit: voor iedereen goed doen en zichzelf wegcijferen. Ik ga ze enorm missen, echt een supermadam.”
In 2015 sprak VRT NWS met Bea Van der Maat over haar leven en werk. Dat interview kan je nog eens lezenvia deze link."
