,source_url,article_title,article_text,date,language
14,https://www.lesoir.be/529354/article/2023-08-04/donald-trump-apres-son-audience-au-tribunal-cest-un-jour-tres-triste-pour,Donald Trump après son audience au tribunal : « C’est un jour très triste pour l’Amérique »,"L’ex-président américain Donald Trump a plaidé jeudi non coupable d’accusations liées à ses manœuvres « criminelles ».« Si vous regardez bien ce qui est en train de se passer, c’est la persécution d’un opposant politique », a déclaré jeudi l’ancien président américain sur le tarmac de l’aéroport Ronald Reagan après sa comparution devant un tribunal fédéral de Washington.« C’était un jour très triste pour l’Amérique », a jugé l’ancien président américain. Avant de monter à bord de son avion, il a dénoncé le complot dont il s’estime faire l’objet.Lors de cette comparution pénale historique devant un tribunal fédéral de Washington, le milliardaire républicain a lui-même répondu debout « non coupable » à la lecture par la juge Moxila Upadhyaya des chefs d’accusation et des peines de prison encourues.Une prochaine audience pour déterminer la date du procès a été fixée au 28 août. Elle se tiendra sous l’autorité de la juge fédérale Tanya Chutkan, qui présidera les débats au procès.",2023-08-04T07:12:01+02:00,fr
15,https://www.lesoir.be/529352/article/2023-08-04/suede-des-emeutes-eclatent-en-marge-dun-festival-et-font-plusieurs-blesses,Suède : des émeutes éclatent en marge d’un festival et font plusieurs blessés,"Plus de cinquante personnes ont été blessées dans la capitale de la Suéde, Stockholm, jeudi, alors que des émeutes ont éclaté en marge d’un festival culturel érythréen.En début de soirée, la police a dénombré au moins 52 personnes présentant des blessures de degrés divers. Une quinzaine ont été transportées à l’hôpital et huit personnes sont grièvement blessées.La police a fait part dans les médias que trois agents font partie des blessés. Celle-ci a ouvert une enquête au sujet de ces émeutes, mais aussi pour incendie et sabotage des services d’urgence.Environ un millier de contre-manifestants étaient réunis sur le site, certains caillassant la police, selon les médias suédois.Des images de la scène témoignent d’incendies sur le site du festival, de véhicules incendiés et détruits, et d’hommes armés de bâtons.Les témoins et journalistes sur place évoquent des scènes de chaos et des bagarres. Selon la police, 180 personnes ont été arrêtées.À lire aussi Autodafés de Coran en Scandinavie : jusqu’où peut aller la liberté d’expression ?Le festival a longtemps été critiqué pour ses liens avec le régime erythréen, considéré comme répressif.Ce festival a été organisé depuis des années au nord de la capitale. Selon la police, il s’agit d’un rassemblement avec des séminaires, débats, compétitions de chants et une foire, entre autres.Un autre rassemblement était en cours juste à côté du site, où les émeutes ont éclaté. Selon le journal Dagens Nyheter, ce festival a été critiqué dans le passé pour inviter des personnalités qui soutiennent le régime en Erythrée.Des émeutes similaires ont été constatées lors d’un festival semblable en Allemagne il y a trois semaines.L’Erythée, d’une population de trois millions d’habitants, est un pays africain situé sur la mer Rouge et isolé de la communauté internationale. Depuis son accès à l’indépendance, il y a trois décennies, le président Isaias Afwerki est à la tête de la dictature à parti unique de ce pays.",2023-08-04T06:46:15+02:00,fr
16,https://www.lesoir.be/529351/article/2023-08-04/etats-unis-deux-militaires-soupconnes-davoir-espionne-pour-la-chine,Etats-Unis : deux militaires soupçonnés d’avoir espionné pour la Chine,"Deux membres de la marine américaine travaillant en Californie sont soupçonnés d’avoir transmis des renseignements sensibles à la Chine, a annoncé jeudi le ministère de la Justice.Les deux hommes ont été récemment arrêtés et inculpés pour avoir envoyé à des espions chinois des photos, vidéos et documents contenant des données critiques sur l’organisation de l’armée américaine, selon un communiqué.« Ces arrestations nous rappellent les efforts incessants et agressifs déployés par la République populaire de Chine pour saper notre démocratie et menacer ceux qui la défendent », a réagi la directrice adjointe de la division du contre-espionnage du FBI, Suzanne Turner, citée dans le communiqué.Les informations transmises sont « susceptibles de compromettre gravement la sécurité nationale des États-Unis », a-t-elle insisté.Le premier suspect, Jinchao Wei, a été arrêté mercredi sur la base navale de San Diego, où il travaillait.Il était machiniste sur le navire d’assaut U.S.S. Essex et est soupçonné d’avoir collaboré avec un agent chinois depuis février 2022, pour lui transmettre des informations concernant le fonctionnement, la sécurité et l’armement de ce vaisseau amphibie.Le soldat de 22 ans a reçu plusieurs milliers de dollars en échange de ces renseignements sensibles, qu’il envoyait par communications cryptées, selon l’accusation. Il encourt une peine d’emprisonnement à perpétuité.Le deuxième marin inculpé, Wenheng Zhao, travaillait sur la base navale du comté de Ventura, au nord de Los Angeles.Ce militaire de 26 ans est soupçonné d’avoir transmis des informations sensibles à un espion chinois se faisant passer pour un chercheur dans le domaine de l’économie maritime, entre août 2021 et mai 2023.L’espion lui aurait remis près de 15.000 dollars, contre des informations détaillées sur un exercice de grande ampleur de la marine américaine dans la région Asie-Pacifique, et contre les schémas électriques et les plans d’un système radar installé sur une base de l’île d’Okinawa, au Japon.En cas de condamnation, le soldat risque jusqu’à 20 ans d’emprisonnement, selon l’accusation.Les Etats-Unis et la Chine se livrent une compétition féroce mais tentent de renouer le dialogue, après des mois de tensions. Washington a ainsi indiqué mardi que le chef de la diplomatie chinoise Wang Yi a été invité à se rendre aux Etats-Unis pour des réunions de haut niveau.A l’été 2022, la visite à Taïwan de l’ex-présidente de la Chambre des représentants, Nancy Pelosi, avait suscité l’ire de Pékin et alimenté les tensions dans la région Asie-Pacifique, théâtre de rivalités entre les deux géants.",2023-08-04T06:34:40+02:00,fr
17,https://www.lesoir.be/529350/article/2023-08-04/coup-detat-au-niger-les-putschistes-riposteront-immediatement-toute-agression,Coup d’Etat au Niger : les putschistes riposteront « immédiatement » à « toute agression »,"Les putschistes au Niger ont annoncé qu’ils riposteront « immédiatement » en cas d’« agression ou tentative d’agression » contre leur pays par la Communauté économique des Etats d’Afrique de l’Ouest (Cédéao), trois jours avant la fin de l’ultimatum décrété par l’organisation pour un retour à l’ordre constitutionnel.« La Cédéao étant impersonnelle, toute agression ou tentative d’agression contre l’Etat du Niger verra une riposte immédiate et sans préavis des Forces de défense et de sécurité nigériennes sur un de ses membres, à l’exception des pays amis suspendus », a déclaré un des putschistes, faisant allusion au Burkina Faso et au Mali.",2023-08-04T06:33:55+02:00,fr
18,https://www.lesoir.be/529349/article/2023-08-04/les-etats-unis-comptent-mettre-des-soldats-sur-les-petroliers-pour-dissuader,Les Etats-Unis comptent mettre des soldats sur les pétroliers pour dissuader l’Iran de les saisir,"Les Etats-Unis comptent mettre des soldats sur des pétroliers qui transitent par le Golfe afin de dissuader l’Iran de saisir ces navires, a annoncé jeudi un responsable américain.« Des mesures ont été prises... pour utiliser des équipes de sécurité composées de Marines et de membres de l’US Navy sur des navires pétroliers marchands qui transitent par et près du détroit d’Ormuz afin de renforcer les défenses de ses bateaux vulnérables », a indiqué cette source à l’AFP sous couvert de l’anonymat.Pour ce faire, une invitation est nécessaire comme ces navires sont privés mais « nous nous préparons à le faire si des accords définitifs sont conclus », a poursuivi le responsable.Ce nouveau niveau de protection viendra s’ajouter au déploiement, annoncé mi-juillet par le Pentagone, d’un navire de guerre et d’avions de combats F-35 et F-16 dans cette zone.Selon l’armée américaine, l’Iran a saisi ou tenté de s’emparer de près de 20 navires battant pavillon international dans la région ces deux dernières années.L’US Navy avait notamment annoncé début juillet s’être opposée à la saisie par l’Iran de deux navires pétroliers dans les eaux internationales au large d’Oman.L’armée iranienne avait par ailleurs saisi fin avril dans le golfe d’Oman un pétrolier battant pavillon des îles Marshall à destination des Etats-Unis, avant de saisir une semaine plus tard un pétrolier battant pavillon du Panama qui transitait dans le détroit d’Ormuz.Les incidents se sont multipliés dans les eaux du Golfe, zone maritime cruciale pour le transport mondial du pétrole, depuis qu’en 2018 les Etats-Unis se sont retirés de l’accord international destiné à limiter le programme nucléaire iranien, réimposant des sanctions à la République islamique visant notamment son secteur pétrolier.",2023-08-04T06:14:28+02:00,fr
19,https://www.lesoir.be/529348/article/2023-08-04/lalerte-de-la-police-judiciaire-bruxelloise-anvers-il-y-de-la-violence-ici-il-y,"L’alerte de la police judiciaire bruxelloise : « A Anvers, il y a de la violence. Ici, il y a des meurtres »","Suite aux révélations du Soir sur l’explosion de la violence dans le milieu des stupéfiants dans la capitale, le directeur de la Police judiciaire fédérale (PJF) de Bruxelles, Eric Jacobs (63 ans), sort du silence médiatique. Mieux, à l’heure du rendez-vous, il est accompagné de quatre autres haut gradés de la PJF bruxelloise, dont les spécialistes des stupéfiants ou du banditisme. Certains ne s’étaient jamais exprimés publiquement. Durant deux heures, ces cinq pontes de la police décrivent une situation inquiétante dans l’arrondissement, avec une violence liée au trafic de stupéfiants « à un niveau jamais atteint ». Depuis le 1er janvier 2023, on dénombre six morts, 20 blessés graves ayant nécessité une hospitalisation, 41 blessés légers.",2023-08-04T06:00:00+02:00,fr
